{"release_keys":[{"algorithm":"ed25519","authorization":{"canonicalization":"braindrive-canonical-json-v1","domain_separator":"BrainDrive-App-Release-Key-v1","signature":"cGagiTXCIHSFG4qXxWiVIHh+jzFQKeGy8dvfwymF4FAgp4neSH/3cyfA2zO/2rEYVRp0KFujmYNYyrYMpG8dCw==","signature_algorithm":"ed25519","signature_version":1,"signing_key_id":"braindrive-app-root-fixture-legacy-2026"},"key_id":"braindrive-app-release-fixture-legacy-2026","key_version":1,"not_after":"2036-01-01T00:00:00.000Z","not_before":"2026-01-01T00:00:00.000Z","public_key":"owGg/cz7vfGia1yuHMstwm3ZwXoXOT0wPA7cwvzYqmo=","status":"active"}],"root_key":{"algorithm":"ed25519","key_id":"braindrive-app-root-fixture-legacy-2026","public_key":"FWW5h9+gqQVhZZEAPzbGzlbaWdlzNejlVpr4AjO5eE4=","status":"active"},"threshold":1,"trust_domain":"braindrive-app-release","trust_root_version":1}
